{
  "worker_id": "dev-worker-C3A2B8E5",
  "worker_type": "implementation-worker",
  "prompt_template": "agents/prompts/workers/implementation-worker.md",
  "parent_master": "development",
  "task_id": "task-1762553468",
  "task_data": {
    "id": "task-1762553468",
    "title": "GOVERNANCE UPGRADE - Phase 5: Compliance Automation & Reporting. Define compliance frameworks (GDPR, SOC2, internal policies), automated compliance checking engine, policy enforcement with automated remediation, comprehensive compliance reporting dashboard. Build ComplianceEngine class with framework definitions, automated policy validation, violation detection and remediation, executive compliance dashboard with metrics. Success criteria: Support 3+ compliance frameworks, 100% policy enforcement, automated remediation for 80%+ violations, compliance report generation <5s.",
    "type": "development",
    "priority": "high",
    "status": "assigned",
    "created_at": "2025-11-11T12:10:14-0600",
    "created_by": "create-task-cli",
    "context": {
      "repository": "ry-ops/cortex",
      "branch": "main",
      "description": "GOVERNANCE UPGRADE - Phase 5: Compliance Automation & Reporting. Define compliance frameworks (GDPR, SOC2, internal policies), automated compliance checking engine, policy enforcement with automated remediation, comprehensive compliance reporting dashboard. Build ComplianceEngine class with framework definitions, automated policy validation, violation detection and remediation, executive compliance dashboard with metrics. Success criteria: Support 3+ compliance frameworks, 100% policy enforcement, automated remediation for 80%+ violations, compliance report generation <5s.",
      "requirements": []
    },
    "routing_confidence": "N/A",
    "routing_strategy": "pattern-based",
    "updated_at": "2025-11-11T16:35:27-06:00",
    "worker_id": null,
    "worker_type": "implementation-worker",
    "zombie_cleanup_at": "2025-11-11T22:35:16Z",
    "previous_worker": "dev-worker-6A60CB30",
    "retry_count": 1,
    "assigned_to": "development",
    "assigned_by": "coordinator",
    "assigned_at": "2025-11-11T16:35:27-0600"
  },
  "context": {
    "master_session": "3A24DCEC-39A6-495F-AC3E-262F0EEEDB03",
    "expertise_area": "",
    "skills_required": [],
    "knowledge_base_refs": {
      "implementation_patterns": "/Users/ryandahlberg/cortex/scripts/../coordination/masters/development/knowledge-base/implementation-patterns.jsonl",
      "architecture_docs": "/Users/ryandahlberg/cortex/scripts/../coordination/masters/development/knowledge-base/codebase-architecture.json"
    }
  },
  "resources": {
    "token_allocation": 50000,
    "time_limit_minutes": 60
  },
  "status": "running",
  "created_at": "2025-11-11T16:36:43-0600",
  "created_by": "development",
  "execution": {
    "started_at": "2025-11-12T07:44:19-0600"
  }
}
