{
  "worker_id": "dev-worker-59528050",
  "worker_type": "feature-implementer",
  "prompt_template": "agents/prompts/workers/implementation-worker.md",
  "parent_master": "development",
  "task_id": "task-1762553434",
  "task_data": {
  "id": "task-1762553434",
  "title": "Create DDQD v5.0 stress test with MoE Intelligence validation: routing accuracy, confidence scores, learning system, sparse activation testing. Keywords: development testing stress-test MoE validation shell-script bash. Implement test_moe_routing test_moe_confidence test_moe_learning test_moe_pool_efficiency functions, run 5min test, generate MoE metrics report.",
  "type": "development",
  "priority": "high",
  "status": "assigned",
  "assigned_to": "development",
  "created_at": "2025-11-08T10:41:38-0600",
  "created_by": "create-task-cli",
  "context": {
    "repository": "ry-ops/cortex",
    "branch": "main",
    "description": "Create DDQD v5.0 stress test with MoE Intelligence validation: routing accuracy, confidence scores, learning system, sparse activation testing. Keywords: development testing stress-test MoE validation shell-script bash. Implement test_moe_routing test_moe_confidence test_moe_learning test_moe_pool_efficiency functions, run 5min test, generate MoE metrics report.",
    "requirements": []
  },
  "assigned_by": "coordinator",
  "assigned_at": "2025-11-08T10:41:47-0600",
  "routing_confidence": "0.95",
  "routing_strategy": "single_expert",
  "updated_at": "2025-11-08T10:41:47-06:00"
},
  "context": {
    "master_session": "3A24DCEC-39A6-495F-AC3E-262F0EEEDB03",
    "expertise_area": "feature_development",
    "skills_required": [
  "design",
  "implementation",
  "testing"
],
    "knowledge_base_refs": {
      "implementation_patterns": "/Users/ryandahlberg/projects/cortex/scripts/../coordination/masters/development/knowledge-base/implementation-patterns.jsonl",
      "architecture_docs": "/Users/ryandahlberg/projects/cortex/scripts/../coordination/masters/development/knowledge-base/codebase-architecture.json"
    }
  },
  "resources": {
    "token_allocation": 15000,
    "time_limit_minutes": 60
  },
  "status": "pending",
  "created_at": "2025-11-08T10:41:58-0600",
  "created_by": "development"
}
