{
  "worker_id": "dev-worker-66187EF4",
  "worker_type": "feature-implementer",
  "prompt_template": "agents/prompts/workers/implementation-worker.md",
  "parent_master": "development",
  "task_id": "task-1762553420",
  "task_data": {
  "id": "task-1762553420",
  "title": "Complete MoE Architecture Integration - Phase 4 Testing & Advanced Features",
  "type": "feature",
  "priority": "medium",
  "status": "assigned",
  "created_at": "2025-11-07T22:10:20Z",
  "context": {
    "description": "Complete the MoE architecture integration by: 1) Testing the full pipeline end-to-end (routing → spawning → execution → learning), 2) Verify dashboard displays MoE metrics correctly, 3) Document the event flow and MoE components, 4) Create example tasks to demonstrate MoE routing with different confidence levels, 5) Test sparse pool activation at different load levels (14%, 50%, 100%), 6) Optional: Implement adaptive threshold optimization for routing confidence scores based on historical accuracy",
    "requirements": [
      "Test MoE routing with sample tasks",
      "Verify event emissions throughout pipeline",
      "Check dashboard MoE views display data",
      "Test sparse pool scaling behavior",
      "Validate learning system updates patterns",
      "Create documentation for MoE architecture"
    ],
    "acceptance_criteria": [
      "All MoE events appear in dashboard-events.jsonl",
      "Dashboard MoE Intelligence views show real data",
      "Routing decisions logged with confidence scores",
      "Pool activation adjusts based on load",
      "Memory manager learns new keywords from tasks",
      "Documentation includes architecture diagram and flow"
    ]
  },
  "assigned_to": "development",
  "assigned_by": "coordinator",
  "assigned_at": "2025-11-07T20:18:33-0600",
  "routing_confidence": "0.03",
  "routing_strategy": "single_expert_low_confidence",
  "updated_at": "2025-11-07T20:18:33-06:00"
},
  "context": {
    "master_session": "3A24DCEC-39A6-495F-AC3E-262F0EEEDB03",
    "expertise_area": "feature_development",
    "skills_required": [
  "design",
  "implementation",
  "testing"
],
    "knowledge_base_refs": {
      "implementation_patterns": "/Users/ryandahlberg/projects/cortex/scripts/../coordination/masters/development/knowledge-base/implementation-patterns.jsonl",
      "architecture_docs": "/Users/ryandahlberg/projects/cortex/scripts/../coordination/masters/development/knowledge-base/codebase-architecture.json"
    }
  },
  "resources": {
    "token_allocation": 15000,
    "time_limit_minutes": 60
  },
  "status": "pending",
  "created_at": "2025-11-08T04:39:48-0600",
  "created_by": "development"
}
