{
  "worker_id": "dev-worker-270EA2BA",
  "worker_type": "implementation-worker",
  "prompt_template": "agents/prompts/workers/implementation-worker.md",
  "parent_master": "development",
  "task_id": "task-1762553453",
  "task_data": {
    "id": "task-1762553453",
    "title": "Post-dashboard fix system improvements: testing, health monitoring, UI enhancements, documentation, performance optimization, and monitoring infrastructure",
    "type": "development",
    "priority": "high",
    "status": "assigned",
    "assigned_to": "development",
    "created_at": "2025-11-09T14:08:40-0600",
    "created_by": "create-task-cli",
    "context": {
      "repository": "ry-ops/cortex",
      "branch": "main",
      "description": "Post-dashboard fix system improvements: testing, health monitoring, UI enhancements, documentation, performance optimization, and monitoring infrastructure",
      "requirements": []
    },
    "assigned_by": "coordinator",
    "assigned_at": "2025-11-09T14:12:22-0600",
    "routing_confidence": "0.95",
    "routing_strategy": "single_expert",
    "updated_at": "2025-11-09T14:12:22-06:00"
  },
  "context": {
    "master_session": "3A24DCEC-39A6-495F-AC3E-262F0EEEDB03",
    "expertise_area": "",
    "skills_required": [],
    "knowledge_base_refs": {
      "implementation_patterns": "/Users/ryandahlberg/Projects/cortex/scripts/../coordination/masters/development/knowledge-base/implementation-patterns.jsonl",
      "architecture_docs": "/Users/ryandahlberg/Projects/cortex/scripts/../coordination/masters/development/knowledge-base/codebase-architecture.json"
    }
  },
  "resources": {
    "token_allocation": 50000,
    "time_limit_minutes": 60
  },
  "status": "completed",
  "created_at": "2025-11-09T14:12:43-0600",
  "created_by": "development",
  "execution": {
    "started_at": "2025-11-11T14:05:35Z"
  },
  "completed_at": "2025-11-11T08:05:41-0600",
  "git_workflow": {
    "status": "success",
    "commit_hash": "95e3318",
    "automated": true
  }
}
