{
  "worker_id": "dev-worker-95965607",
  "worker_type": "feature-implementer",
  "prompt_template": "agents/prompts/workers/implementation-worker.md",
  "parent_master": "development",
  "task_id": "task-1762553429",
  "task_data": {
  "id": "task-1762553429",
  "title": "Implement ML-based cache optimization using historical access patterns. Train model to predict which RAG knowledge should be promoted to CAG cache. Use decision tree or gradient boosting to optimize cache content based on access frequency, query patterns, and worker success rates.",
  "type": "development",
  "priority": "low",
  "status": "assigned",
  "assigned_to": "development",
  "created_at": "2025-11-08T04:44:43-0600",
  "created_by": "create-task-cli",
  "context": {
    "repository": "ry-ops/cortex",
    "branch": "main",
    "description": "Implement ML-based cache optimization using historical access patterns. Train model to predict which RAG knowledge should be promoted to CAG cache. Use decision tree or gradient boosting to optimize cache content based on access frequency, query patterns, and worker success rates.",
    "requirements": []
  },
  "assigned_by": "coordinator",
  "assigned_at": "2025-11-08T04:44:52-0600",
  "routing_confidence": "0.95",
  "routing_strategy": "single_expert",
  "updated_at": "2025-11-08T04:44:52-06:00"
},
  "context": {
    "master_session": "3A24DCEC-39A6-495F-AC3E-262F0EEEDB03",
    "expertise_area": "feature_development",
    "skills_required": [
  "design",
  "implementation",
  "testing"
],
    "knowledge_base_refs": {
      "implementation_patterns": "/Users/ryandahlberg/projects/cortex/scripts/../coordination/masters/development/knowledge-base/implementation-patterns.jsonl",
      "architecture_docs": "/Users/ryandahlberg/projects/cortex/scripts/../coordination/masters/development/knowledge-base/codebase-architecture.json"
    }
  },
  "resources": {
    "token_allocation": 15000,
    "time_limit_minutes": 60
  },
  "status": "pending",
  "created_at": "2025-11-08T04:45:00-0600",
  "created_by": "development"
}
