{
  "worker_id": "sec-worker-7A7CFD6E",
  "worker_type": "scan-worker",
  "prompt_template": "agents/prompts/workers/scan-worker.md",
  "parent_master": "security",
  "task_id": "task-1762553466",
  "task_data": {
    "title": "GOVERNANCE UPGRADE - Phase 3: Automated Data Lineage & Audit Trails",
    "type": "development",
    "priority": "high",
    "status": "pending",
    "retry_count": 2,
    "previous_failure": "launcher_bug_task_context_injection_failure",
    "description": "Implement comprehensive lineage tracking and audit trail system integrated with Phase 1 catalog and Phase 2 access control. Build LineageTracker class for recording all operations, implement comprehensive audit trail logging, create lineage visualization (source → transformation → target), add audit query interface and compliance reports.",
    "success_criteria": [
      "100% operation lineage tracked",
      "audit trail completeness 99.9%",
      "lineage query response <500ms",
      "compliance report generation <2 seconds"
    ]
  },
  "context": {
    "master_session": "D3E7AA88-CB9B-44A8-A1DC-8BEE4B0FA048",
    "expertise_area": "vulnerability_detection",
    "skills_required": [
      "dependency_scanning",
      "static_analysis",
      "secrets_detection"
    ],
    "knowledge_base_refs": {
      "vulnerability_database": "/Users/ryandahlberg/cortex/scripts/../coordination/masters/security/knowledge-base/vulnerability-history.jsonl",
      "remediation_strategies": "/Users/ryandahlberg/cortex/scripts/../coordination/masters/security/knowledge-base/remediation-patterns.json",
      "false_positives": "/Users/ryandahlberg/cortex/scripts/../coordination/masters/security/knowledge-base/false-positives.json"
    },
    "relevant_past_findings": {}
  },
  "resources": {
    "token_allocation": 12000,
    "time_limit_minutes": 60
  },
  "status": "running",
  "created_at": "2025-11-12T13:43:30-0600",
  "created_by": "security",
  "execution": {
    "started_at": "2025-11-12T14:42:45-0600"
  }
}
