{
  "worker_id": "sec-worker-AAC692A5",
  "worker_type": "scan-worker",
  "prompt_template": "agents/prompts/workers/scan-worker.md",
  "parent_master": "security",
  "task_id": "task-1762553467",
  "task_data": {
    "id": "task-1762553467",
    "title": "GOVERNANCE UPGRADE - Phase 4: AI-Powered Monitoring & Quality Assurance. Implement AI-powered data quality monitoring, automatic PII detection and tagging, model drift detection for agents, proactive monitoring dashboard. Build QualityMonitor class with automated data quality checks, PII scanner with automatic tagging, agent performance monitoring with drift detection, real-time monitoring dashboard with alerts. Success criteria: 100% data quality monitoring coverage, PII detection accuracy >99%, drift detection latency <1s, zero false positives in monitoring.",
    "type": "development",
    "priority": "high",
    "status": "assigned",
    "created_at": "2025-11-11T12:10:12-0600",
    "created_by": "create-task-cli",
    "context": {
      "repository": "ry-ops/cortex",
      "branch": "main",
      "description": "GOVERNANCE UPGRADE - Phase 4: AI-Powered Monitoring & Quality Assurance. Implement AI-powered data quality monitoring, automatic PII detection and tagging, model drift detection for agents, proactive monitoring dashboard. Build QualityMonitor class with automated data quality checks, PII scanner with automatic tagging, agent performance monitoring with drift detection, real-time monitoring dashboard with alerts. Success criteria: 100% data quality monitoring coverage, PII detection accuracy >99%, drift detection latency <1s, zero false positives in monitoring.",
      "requirements": []
    },
    "routing_confidence": "N/A",
    "routing_strategy": "pattern-based",
    "updated_at": "2025-11-11T16:35:27-06:00",
    "worker_id": null,
    "worker_type": "implementation-worker",
    "zombie_cleanup_at": "2025-11-11T22:35:16Z",
    "previous_worker": "dev-worker-3EFCF595",
    "retry_count": 1,
    "assigned_to": "security",
    "assigned_by": "coordinator",
    "assigned_at": "2025-11-11T16:35:27-0600"
  },
  "context": {
    "master_session": "D3E7AA88-CB9B-44A8-A1DC-8BEE4B0FA048",
    "expertise_area": "vulnerability_detection",
    "skills_required": [
      "dependency_scanning",
      "static_analysis",
      "secrets_detection"
    ],
    "knowledge_base_refs": {
      "vulnerability_database": "/Users/ryandahlberg/cortex/scripts/../coordination/masters/security/knowledge-base/vulnerability-history.jsonl",
      "remediation_strategies": "/Users/ryandahlberg/cortex/scripts/../coordination/masters/security/knowledge-base/remediation-patterns.json",
      "false_positives": "/Users/ryandahlberg/cortex/scripts/../coordination/masters/security/knowledge-base/false-positives.json"
    },
    "relevant_past_findings": {}
  },
  "resources": {
    "token_allocation": 12000,
    "time_limit_minutes": 60
  },
  "status": "running",
  "created_at": "2025-11-11T16:36:57-0600",
  "created_by": "security",
  "execution": {
    "started_at": "2025-11-12T07:44:40-0600"
  }
}
