{
  "worker_id": "dev-worker-98C59170",
  "worker_type": "feature-implementer",
  "prompt_template": "agents/prompts/workers/implementation-worker.md",
  "parent_master": "development",
  "task_id": "task-1762553422",
  "task_data": {
  "id": "task-1762553422",
  "title": "Implement vector embedding generation using sentence-transformers/all-MiniLM-L6-v2 for RAG similarity search. Create Python script to generate 384-dim embeddings for coordination knowledge base and store in JSONL format in coordination/vector-db/embeddings/",
  "type": "development",
  "priority": "medium",
  "status": "assigned",
  "assigned_to": "development",
  "created_at": "2025-11-08T04:39:05-0600",
  "created_by": "create-task-cli",
  "context": {
    "repository": "ry-ops/cortex",
    "branch": "main",
    "description": "Implement vector embedding generation using sentence-transformers/all-MiniLM-L6-v2 for RAG similarity search. Create Python script to generate 384-dim embeddings for coordination knowledge base and store in JSONL format in coordination/vector-db/embeddings/",
    "requirements": []
  },
  "assigned_by": "coordinator",
  "assigned_at": "2025-11-08T04:39:33-0600",
  "routing_confidence": "0.95",
  "routing_strategy": "single_expert",
  "updated_at": "2025-11-08T04:39:33-06:00"
},
  "context": {
    "master_session": "3A24DCEC-39A6-495F-AC3E-262F0EEEDB03",
    "expertise_area": "feature_development",
    "skills_required": [
  "design",
  "implementation",
  "testing"
],
    "knowledge_base_refs": {
      "implementation_patterns": "/Users/ryandahlberg/projects/cortex/scripts/../coordination/masters/development/knowledge-base/implementation-patterns.jsonl",
      "architecture_docs": "/Users/ryandahlberg/projects/cortex/scripts/../coordination/masters/development/knowledge-base/codebase-architecture.json"
    }
  },
  "resources": {
    "token_allocation": 15000,
    "time_limit_minutes": 60
  },
  "status": "pending",
  "created_at": "2025-11-08T04:39:48-0600",
  "created_by": "development"
}
